{
  "$schema": "https://json-schema.org/draft/2020-12/schema",
  "title": "Tagged personal records, version 1",
  "description": "Generic ordered text and file records. Tags are plain labels; relatedTo links contextual records.",
  "type": "object",
  "additionalProperties": false,
  "required": [
    "formatVersion",
    "language",
    "entries"
  ],
  "properties": {
    "formatVersion": {
      "const": 1
    },
    "language": {
      "type": "string",
      "pattern": "^[A-Za-z]{2,8}(-[A-Za-z0-9]{1,8})*$"
    },
    "isSample": {
      "type": "boolean"
    },
    "entries": {
      "type": "array",
      "items": {
        "$ref": "#/$defs/entry"
      }
    }
  },
  "$defs": {
    "nonBlank": {
      "type": "string",
      "minLength": 1,
      "pattern": "\\S"
    },
    "timestamp": {
      "type": "string",
      "format": "date-time",
      "pattern": "^\\d{4}-\\d{2}-\\d{2}T\\d{2}:\\d{2}:\\d{2}(\\.\\d+)?Z$"
    },
    "entry": {
      "type": "object",
      "additionalProperties": false,
      "required": [
        "id",
        "tags"
      ],
      "properties": {
        "id": {
          "type": "string",
          "pattern": "^[A-Za-z0-9][A-Za-z0-9_-]{0,127}$"
        },
        "tags": {
          "type": "array",
          "uniqueItems": true,
          "items": {
            "$ref": "#/$defs/nonBlank"
          }
        },
        "text": {
          "$ref": "#/$defs/nonBlank"
        },
        "filePath": {
          "type": "string",
          "pattern": "^media/[A-Za-z0-9][A-Za-z0-9_-]*\\.(jpg|jpeg|png|webp)$"
        },
        "relatedTo": {
          "type": "array",
          "uniqueItems": true,
          "items": {
            "type": "string",
            "pattern": "^[A-Za-z0-9][A-Za-z0-9_-]{0,127}$"
          }
        },
        "createdAt": {
          "$ref": "#/$defs/timestamp"
        },
        "modificationDates": {
          "type": "array",
          "uniqueItems": true,
          "items": {
            "$ref": "#/$defs/timestamp"
          }
        }
      },
      "oneOf": [
        {
          "required": [
            "text"
          ],
          "properties": {
            "text": {}
          }
        },
        {
          "required": [
            "filePath"
          ],
          "properties": {
            "filePath": {}
          }
        }
      ]
    }
  }
}
